{
  "benchmark_id": "bootstrap-track-b-python-subset",
  "run_id": "python-proof-loop-full-20260403T165316Z",
  "system_under_test": "scir-bootstrap-executable-path",
  "track": "B",
  "profile": "R",
  "metrics": {
    "supported_case_count": 4,
    "tier_a_compile_pass_rate": 1.0,
    "tier_a_test_pass_rate": 1.0,
    "idiomaticity_mean": 5.0,
    "opaque_fraction": 0.125,
    "gate_S1_pass": true,
    "gate_S4_pass": true,
    "gate_K3_hit": false,
    "gate_K4_hit": false,
    "preservation_level_ceiling": "P3",
    "tier_a_feature_count": 7,
    "tier_b_feature_count": 0,
    "tier_c_feature_count": 1,
    "tier_d_feature_count": 0
  },
  "baseline_comparison": {
    "direct source": 0.0,
    "typed-AST": 0.0,
    "lightweight regularized core or s-expression": 0.0
  },
  "status": "pass",
  "evidence": [
    "validated importer outputs",
    "reconstruction compile/test harness"
  ],
  "commit_sha": "427ecb865ab4184fbcb0014cd512d476fc4f124f",
  "spec_version": "v0.1-draft",
  "tool_version": "scir-benchmark-audit-v1",
  "baseline_name": "scir",
  "corpus_manifest_hash": "sha256:0c3b78d3b092277d89bb79a7df485b3f794b3ae30668acbed4fba318b48e4398",
  "artifact_rows": [
    {
      "run_id": "python-proof-loop-full-20260403T165316Z",
      "commit_sha": "427ecb865ab4184fbcb0014cd512d476fc4f124f",
      "spec_version": "v0.1-draft",
      "tool_version": "scir-benchmark-audit-v1",
      "baseline_name": "scir",
      "corpus_manifest_hash": "sha256:0c3b78d3b092277d89bb79a7df485b3f794b3ae30668acbed4fba318b48e4398",
      "artifact_id": "fixture.python_importer.a_basic_function",
      "frontend": "python",
      "tier": "A",
      "split": "test",
      "origin": "checked_in_fixture",
      "sample_class": "real",
      "profile": "R",
      "construct_family": "branch-local-mutation",
      "fixture_set": "python-proof-loop",
      "slice_id": "frontend=python|tier=A|split=test|profile=R|pipeline_stage=h_to_python|construct_family=branch-local-mutation|fixture_set=python-proof-loop",
      "stage": "h_to_python",
      "status": "pass",
      "diagnostic_codes": [],
      "metrics": {
        "token_count": 19,
        "source_token_count": 19,
        "edit_distance": 0,
        "LCR": null,
        "GR": 1.0,
        "SE": null,
        "SCPR": 1.0,
        "round_trip": 1.0
      },
      "preservation_requested": "P1",
      "preservation_expected": "P1",
      "preservation_observed": "P1",
      "preservation_expectation_status": "match",
      "preservation_downgrade_count": 0,
      "boundary_annotation_count": 0,
      "opaque_fraction": 0.0,
      "unsupported_fraction": 0.0,
      "unsupported_tags": [],
      "compile_pass": true,
      "test_pass": true,
      "duration_ms": 0,
      "reproducibility_block": {
        "command": "python scripts/scir_sweep.py --manifest scir_benchmark_sweep_3fqf4mc6/benchmark_sweep.json",
        "environment": {
          "python_executable": "C:\\Users\\Forre\\AppData\\Local\\Python\\pythoncore-3.14-64\\python.exe",
          "python_version": "3.14.2",
          "platform": "Windows-10-10.0.19045-SP0",
          "cwd": "G:\\GitHub\\incubate\\SCIR"
        },
        "seed": 0,
        "timestamp": "2026-04-03T16:53:16.662879+00:00"
      }
    },
    {
      "run_id": "python-proof-loop-full-20260403T165316Z",
      "commit_sha": "427ecb865ab4184fbcb0014cd512d476fc4f124f",
      "spec_version": "v0.1-draft",
      "tool_version": "scir-benchmark-audit-v1",
      "baseline_name": "scir",
      "corpus_manifest_hash": "sha256:0c3b78d3b092277d89bb79a7df485b3f794b3ae30668acbed4fba318b48e4398",
      "artifact_id": "fixture.python_importer.a_async_await",
      "frontend": "python",
      "tier": "A",
      "split": "test",
      "origin": "checked_in_fixture",
      "sample_class": "real",
      "profile": "R",
      "construct_family": "async-await",
      "fixture_set": "python-proof-loop",
      "slice_id": "frontend=python|tier=A|split=test|profile=R|pipeline_stage=h_to_python|construct_family=async-await|fixture_set=python-proof-loop",
      "stage": "h_to_python",
      "status": "pass",
      "diagnostic_codes": [],
      "metrics": {
        "token_count": 19,
        "source_token_count": 19,
        "edit_distance": 0,
        "LCR": null,
        "GR": 1.0,
        "SE": null,
        "SCPR": 1.0,
        "round_trip": 1.0
      },
      "preservation_requested": "P1",
      "preservation_expected": "P1",
      "preservation_observed": "P1",
      "preservation_expectation_status": "match",
      "preservation_downgrade_count": 0,
      "boundary_annotation_count": 0,
      "opaque_fraction": 0.0,
      "unsupported_fraction": 0.0,
      "unsupported_tags": [],
      "compile_pass": true,
      "test_pass": true,
      "duration_ms": 0,
      "reproducibility_block": {
        "command": "python scripts/scir_sweep.py --manifest scir_benchmark_sweep_3fqf4mc6/benchmark_sweep.json",
        "environment": {
          "python_executable": "C:\\Users\\Forre\\AppData\\Local\\Python\\pythoncore-3.14-64\\python.exe",
          "python_version": "3.14.2",
          "platform": "Windows-10-10.0.19045-SP0",
          "cwd": "G:\\GitHub\\incubate\\SCIR"
        },
        "seed": 0,
        "timestamp": "2026-04-03T16:53:16.662879+00:00"
      }
    },
    {
      "run_id": "python-proof-loop-full-20260403T165316Z",
      "commit_sha": "427ecb865ab4184fbcb0014cd512d476fc4f124f",
      "spec_version": "v0.1-draft",
      "tool_version": "scir-benchmark-audit-v1",
      "baseline_name": "scir",
      "corpus_manifest_hash": "sha256:0c3b78d3b092277d89bb79a7df485b3f794b3ae30668acbed4fba318b48e4398",
      "artifact_id": "fixture.python_importer.b_direct_call",
      "frontend": "python",
      "tier": "A",
      "split": "test",
      "origin": "checked_in_fixture",
      "sample_class": "real",
      "profile": "R",
      "construct_family": "direct-call",
      "fixture_set": "python-proof-loop",
      "slice_id": "frontend=python|tier=A|split=test|profile=R|pipeline_stage=h_to_python|construct_family=direct-call|fixture_set=python-proof-loop",
      "stage": "h_to_python",
      "status": "pass",
      "diagnostic_codes": [],
      "metrics": {
        "token_count": 19,
        "source_token_count": 19,
        "edit_distance": 0,
        "LCR": null,
        "GR": 1.0,
        "SE": null,
        "SCPR": 1.0,
        "round_trip": 1.0
      },
      "preservation_requested": "P1",
      "preservation_expected": "P1",
      "preservation_observed": "P1",
      "preservation_expectation_status": "match",
      "preservation_downgrade_count": 0,
      "boundary_annotation_count": 0,
      "opaque_fraction": 0.0,
      "unsupported_fraction": 0.0,
      "unsupported_tags": [],
      "compile_pass": true,
      "test_pass": true,
      "duration_ms": 0,
      "reproducibility_block": {
        "command": "python scripts/scir_sweep.py --manifest scir_benchmark_sweep_3fqf4mc6/benchmark_sweep.json",
        "environment": {
          "python_executable": "C:\\Users\\Forre\\AppData\\Local\\Python\\pythoncore-3.14-64\\python.exe",
          "python_version": "3.14.2",
          "platform": "Windows-10-10.0.19045-SP0",
          "cwd": "G:\\GitHub\\incubate\\SCIR"
        },
        "seed": 0,
        "timestamp": "2026-04-03T16:53:16.662879+00:00"
      }
    },
    {
      "run_id": "python-proof-loop-full-20260403T165316Z",
      "commit_sha": "427ecb865ab4184fbcb0014cd512d476fc4f124f",
      "spec_version": "v0.1-draft",
      "tool_version": "scir-benchmark-audit-v1",
      "baseline_name": "scir",
      "corpus_manifest_hash": "sha256:0c3b78d3b092277d89bb79a7df485b3f794b3ae30668acbed4fba318b48e4398",
      "artifact_id": "fixture.python_importer.c_opaque_call",
      "frontend": "python",
      "tier": "C",
      "split": "test",
      "origin": "checked_in_fixture",
      "sample_class": "real",
      "profile": "D-PY",
      "construct_family": "opaque-boundary",
      "fixture_set": "python-proof-loop",
      "slice_id": "frontend=python|tier=C|split=test|profile=D-PY|pipeline_stage=h_to_python|construct_family=opaque-boundary|fixture_set=python-proof-loop",
      "stage": "h_to_python",
      "status": "pass",
      "diagnostic_codes": [],
      "metrics": {
        "token_count": 13,
        "source_token_count": 13,
        "edit_distance": 0,
        "LCR": null,
        "GR": 1.0,
        "SE": null,
        "SCPR": 1.0,
        "round_trip": 1.0
      },
      "preservation_requested": "P3",
      "preservation_expected": "P3",
      "preservation_observed": "P3",
      "preservation_expectation_status": "match",
      "preservation_downgrade_count": 1,
      "boundary_annotation_count": 1,
      "opaque_fraction": 0.5,
      "unsupported_fraction": 1.0,
      "unsupported_tags": [
        "boundary_only"
      ],
      "compile_pass": true,
      "test_pass": true,
      "duration_ms": 0,
      "reproducibility_block": {
        "command": "python scripts/scir_sweep.py --manifest scir_benchmark_sweep_3fqf4mc6/benchmark_sweep.json",
        "environment": {
          "python_executable": "C:\\Users\\Forre\\AppData\\Local\\Python\\pythoncore-3.14-64\\python.exe",
          "python_version": "3.14.2",
          "platform": "Windows-10-10.0.19045-SP0",
          "cwd": "G:\\GitHub\\incubate\\SCIR"
        },
        "seed": 0,
        "timestamp": "2026-04-03T16:53:16.662879+00:00"
      }
    }
  ],
  "reproducibility_block": {
    "command": "python scripts/benchmark_contract_dry_run.py --claim-run",
    "environment": {
      "python_executable": "C:\\Users\\Forre\\AppData\\Local\\Python\\pythoncore-3.14-64\\python.exe",
      "python_version": "3.14.2",
      "platform": "Windows-10-10.0.19045-SP0",
      "cwd": "G:\\GitHub\\incubate\\SCIR"
    },
    "seed": 0,
    "timestamp": "2026-04-03T16:53:16.662879+00:00"
  }
}
